"rut","nombre","correo","telefono","nombre_proy","resumen_proy","obj_general","obj_especificos","proy_previos","problema","afectados","tamano","solucion","estado_arte","grado_diferenciacion","estado_arte-2","grado_madurez","grado_diferenciacion-2","hipotesis","mercado_obj","continuidad","actores","nombre_resp","rut_resp","ua_resp","cv_resp","investigadores","patrocinadores","plan_presupuesto","presupuesto_total"
"20358887-9","Monserrat Muñoz","monserrat.munoz@pucv.cl","56989280469","PRUEBA","PRUEBA","PRUEBA","PRUEBA","[{""nombre_codigo"":""PRUEBA"",""fuente_fin"":""PRUEBA"",""anos_ejecu"":""PRUEBA"",""resumen"":""PRUEBA""}]","PRUEBA","PRUEBA","PRUEBA","PRUEBA","PRUEBA","PRUEBA","PRUEBA","PRUEBA","PRUEBA","PRUEBA","PRUEBA","PRUEBA","PRUEBA","PRUEBA","20358887-9","PRUEBA","PRUEBA","[{""nombre_invest"":""PRUEBA"",""rut_invest"":""20358887-9"",""unidad_academica_invest"":""PRUEBA""}]","[{""nombre_patrot"":""PRUEBA"",""rut_patro"":""PRUEBA"",""rubro_patro"":""PRUEBA"",""region_patro"":""PRUEBA"",""ciudad_patro"":""PRUEBA"",""descripcion_patro"":""PRUEBA"",""link_carta"":""PRUEBA""}]","[{""obj_especifico"":""PRUEBA"",""actividades"":[{""nombre_act"":""PRUEBA"",""descripcion"":""PRUEBA"",""presupuesto"":""1"",""meses"":""PRUEBA""}]}]","PRUEBA"
"20838995-5","Alex Otto Vicencio","alex.otto.v@mail.pucv.cl","946917186","Nombre del Proyecto","Resumen del Proyecto","Objetivo General","Objetivo Especifícos","[{""nombre_codigo"":""Nombre o Código:"",""fuente_fin"":""Nombre o Código: Fuente de Financiamiento:"",""anos_ejecu"":""Años de Ejecución:"",""resumen"":""Resumen:""}]","Problema","Afectados","Tamaño","Solución","Estado del arte","Grado de diferenciacion","Estado del arte","Grado de Madurez Tecnológica de la SoluciónIndique en qué nivel se encuentra su propuesta según la escala de madurez tecnológica (TRL - Technology Readiness Level). Indique evidencia que respalda su selección (ej. publicaciones, prototipos, pruebas de concepto, certificaciones, pilotos, implementaciones en entornos reales, etc.).","Grado de diferenciacion","¿Cuál es la hipótesis que se pondrá a prueba?Plantee la hipótesis científica y/o tecnológica que se abordará en el desarrollo del presente proyecto.Máximo 2000 caracteres.","Mercado objetivo","Continuidad","","Nombre Investigador Responsable","20838995-5","Unidad Academica Investigador Responsable","CV Responsable (o link a archivo)","[{""nombre_invest"":""Nombre del Investigador:"",""rut_invest"":""20838995-5"",""unidad_academica_invest"":""Unidad académica:""}]","[{""nombre_patrot"":""Nombre del Patrocinador:"",""rut_patro"":""20838995-5"",""rubro_patro"":""Rubro del Patrocinador:"",""region_patro"":""Región del Patrocinador:"",""ciudad_patro"":""Ciudad del Patrocinador:"",""descripcion_patro"":""Descripción del Patrocinador:"",""link_carta"":""Link de Carta:""}]","[{""obj_especifico"":""Objetivo específico:"",""actividades"":[{""nombre_act"":""Nombre de la actividad:"",""descripcion"":""Descripción:"",""presupuesto"":""1"",""meses"":""1""}]}]","1"
"20838995-5","Alex Otto Vicencio","alex.otto.v@mail.pucv.cl","946917186","TESTING ACTORES","Resumen del Proyecto","Objetivo General","Objetivo Especifícos","[{""nombre_codigo"":""Nombre o Código:"",""fuente_fin"":""Fuente de Financiamiento:"",""anos_ejecu"":""Años de Ejecución:"",""resumen"":""Resumen:""}]","Problema

Justifique cualitativa y cuantitativamente el problema seleccionado. Máximo 2000 caracteres.","Afectados

Identifique a los principales actores que afecta el problema. Máximo 2000 caracteres.","Tamaño

Dimensionar, en términos no monetarios, el tamaño del problema. Máximo 2000 caracteres.","Solución

Explique en qué consiste el producto, servicio y/o proceso final que busca desarrollar e indique sus principales atributos. Máximo 3500 caracteres.","Estado del arte

Describa avances científicos y tecnológicos relacionados con la propuesta de solución, incluir enlaces a sus principales referencias (publicaciones, patentes, etc.). Máximo 2000 caracteres.","Grado de diferenciacion

Comparación cuantitativa de características diferenciadoras de la solución final con productos, servicios y/o procesos competidores. Máximo 2000 caracteres.","Estado del arte

Describa avances científicos y tecnológicos relacionados con la propuesta de solución, incluir enlaces a sus principales referencias (publicaciones, patentes, etc.). Máximo 2000 caracteres.","Grado de Madurez Tecnológica de la Solución

Indique en qué nivel se encuentra su propuesta según la escala de madurez tecnológica (TRL - Technology Readiness Level). Indique evidencia que respalda su selección (ej. publicaciones, prototipos, pruebas de concepto, certificaciones, pilotos, implementaciones en entornos reales, etc.).","Grado de diferenciacion

Comparación cuantitativa de características diferenciadoras de la solución final con productos, servicios y/o procesos competidores. Máximo 2000 caracteres.","¿Cuál es la hipótesis que se pondrá a prueba?

Plantee la hipótesis científica y/o tecnológica que se abordará en el desarrollo del presente proyecto.Máximo 2000 caracteres.","Mercado objetivo

Describa y cuantifique el mercado objetivo de la solución final. Deseable cuantificar en términos monetarios la magnitud del mercado, los ingresos o ahorros de costo anuales que se generan para los clientes finales. Máximo 3500 caracteres.","Continuidad

Fuentes de financiamiento que desea optar para continuar con el desarrollo. Máximo ½ página.","¿Cuál o cuáles son los actores o entidades claves para el desarrollo del proyecto?

Señale aquellas entidades, empresas y/o instituciones, públicas y/o privadas, que considera relevante para el desarrollo del proyecto, el grado de vinculación que mantiene con ellas actualmente y cuál sería el aporte directo al proyecto.Máximo 2000 caracteres","Nombre Investigador Responsable","20838995-5","Nombre Investigador Responsable","CV Responsable (o link a archivo)","[{""nombre_invest"":""Nombre del Investigador:"",""rut_invest"":""20838995-5"",""unidad_academica_invest"":""Unidad académica:""}]","[{""nombre_patrot"":""Nombre del Patrocinador:"",""rut_patro"":""20838995-5"",""rubro_patro"":""Rubro del Patrocinador:"",""region_patro"":""Región del Patrocinador:"",""ciudad_patro"":""Ciudad del Patrocinador:"",""descripcion_patro"":""Descripción del Patrocinador:"",""link_carta"":""Link de Carta:""}]","[{""obj_especifico"":""Objetivo específico:"",""actividades"":[{""nombre_act"":""Nombre de la actividad:"",""descripcion"":""Descripción:"",""presupuesto"":""200000"",""meses"":""Presupuesto: Meses:""}]}]","200000"
"20838995-5","Alex Otto Vicencio","alex.otto.v@mail.pucv.cl","946917186","Nombre del Proyecto","Resumen del Proyecto","Objetivo General","Objetivo Especifícos","[{""nombre_codigo"":""Nombre o Código:"",""fuente_fin"":""Fuente de Financiamiento:"",""anos_ejecu"":""Años de Ejecución:"",""resumen"":""Resumen:""}]","Problema","Afectados

Identifique a los prin","Tamaño","Solución","Estado del arte","Grado de diferenciacion","Estado del arte","Grado de Madurez Tecnológica de la Solución","Grado de diferenciacion","¿Cuál es la hipótesis que se pondrá a prueba?","Mercado objetivo","Continuidad","¿Cuál o cuáles son los actores o entidades claves para el desarrollo del proyecto?","Nombre Investigador Responsable","20838995-5","Unidad Academica Investigador Responsable","cCV Responsable (o link a archivo)","[{""nombre_invest"":""Nombre del Investigador:"",""rut_invest"":""20838995-5"",""unidad_academica_invest"":""Unidad académica:""}]","[{""nombre_patrot"":""Nombre del Patrocinador:"",""rut_patro"":""20838995-5"",""rubro_patro"":""Rubro del Patrocinador:"",""region_patro"":""Región del Patrocinador:"",""ciudad_patro"":""Ciudad del Patrocinador:"",""descripcion_patro"":""Ciudad del Patrocinador:\nDescripción del Patrocinador:"",""link_carta"":""Ciudad del Patrocinador: Descripción del Patrocinador:""}]","[{""obj_especifico"":""Objetivo específico:"",""actividades"":[{""nombre_act"":""Nombre de la actividad:"",""descripcion"":""Descripción:"",""presupuesto"":""200000"",""meses"":""222""}]}]","222"
